postID,postTitle,postBody,postScore,postDate,subredditName,subredditID
t3_23q2n1,"What's the best case of ""OP delivers"" on Reddit?","",2657,20140422184637,AskReddit,t5_2qh1i
t3_23pxjq,"Doctors of reddit, what is your most awkward experience when dealing with members of the opposite sex? NSFW","Edit: please try and refrain from acronyms because  us uneducated folk have no idea what your referring to. ",2405,20140422175224,AskReddit,t5_2qh1i
t3_23qmks,"What looks easy until you try it?","",948,20140422222323,AskReddit,t5_2qh1i
t3_23qnlt,"What's a common movie cliché that really annoys you?","Edit: I don't mean stupid details that movies ignore. Just uncreative writing that happens in almost every movie.",548,20140422223519,AskReddit,t5_2qh1i
t3_23q8nb,"What is the Most Evil, Sadistic, Generally Disturbing thing you've done in a video game?","Any game at all.",315,20140422195058,AskReddit,t5_2qh1i
t3_23qfwk,"What harsh truths would you like to speak if not for the fear of confrontation and backlash?","",257,20140422210842,AskReddit,t5_2qh1i
t3_23pw9d,"What are the basics of sex everybody should know? [Serious]","Okay..by basics I meant technique. Not that the dick goes into the vagina.",208,20140422173835,AskReddit,t5_2qh1i
t3_23pq3r,"What would be the most hurtful response to ""I love you""?","",173,20140422163540,AskReddit,t5_2qh1i
t3_23qcti,"Reddit, what is something you always forget?","",112,20140422203532,AskReddit,t5_2qh1i
t3_23qhz0,"Podcast listeners, what are your favorites?","I can't seem to find anything interesting enough to listen to it more than just a few times.",79,20140422213132,AskReddit,t5_2qh1i
t3_23qhz7,"Children that are aware of their parents having sex, what weird routines do they do to try and hide the fact that they are doing it?","",52,20140422213134,AskReddit,t5_2qh1i
t3_23pspo,"Reddit, what's something you suggest everyone does at least once in their life?","",48,20140422170222,AskReddit,t5_2qh1i
t3_23prqa,"[Serious]Did you get bullied in school? If so, how did they bully you?","Hey everyone. I really wanted to ask this question, so some people can have an outlet. I've been bullied real bad when I was in high school. So, were any of you bullied? How so?",40,20140422165152,AskReddit,t5_2qh1i
t3_23qi8a,"Has someone ever died because of a mistake or bad decision you have made? What were the ramifications? How is your life now? [serious]","feel free to provide as little or as much detail as you would like.",37,20140422213407,AskReddit,t5_2qh1i
t3_23pzag,"What's a stupid thing that people brag about?","Besides drinking and drugs and stuff like that 
Edit: I had someone tell me ""I don't mean to brag, but I am pretty good at Mario Cart"" ",27,20140422181119,AskReddit,t5_2qh1i
t3_23qb6r,"What is your worst ""that sounded better in my head"" moment","",27,20140422201756,AskReddit,t5_2qh1i
t3_23qb28,"If you could vote one movie or book fictional character into office as the president who would you chose?","",25,20140422201643,AskReddit,t5_2qh1i
t3_23qska,"Reddit, what's your best ""Wow, I can't believe that actually worked"" moment?","",27,20140422233925,AskReddit,t5_2qh1i
t3_23pttq,"If humans were more animal-like, and only craved sex during a ""mating season,"" what would be the societal ramifications?","",23,20140422171357,AskReddit,t5_2qh1i
t3_23qmd8,"Have any of you been so overwhelmed with something you just decided to not do anything about it?","First post, figured why not start posting now. I have a chem test tomorrow on so much material I don't know how to do I've just quit. I could try to get as much as I can, but hey, fuck it. ",25,20140422222116,AskReddit,t5_2qh1i
t3_23ptst,"Reddit , can you give a summary of a well known movie , and have minimal amount of people figure it out?","Okay , i figure people are going to use vague summaries , but for a harder challenge , use a detailed summary.",21,20140422171340,AskReddit,t5_2qh1i
t3_23qpjv,"What bad movie do you love the most?","",18,20140422230013,AskReddit,t5_2qh1i
t3_23qhur,"What easy, short, and otherwise simple task do you irrationally hate?","Doesn't matter what it is, as long as it inspires your wrath every time you have to do it. ",18,20140422213020,AskReddit,t5_2qh1i
t3_23q5sb,"If you could choose any superpower what would you choose... Given that the next commentator gets to condition it?","Repost I know, but I really want to see some new answers",18,20140422192108,AskReddit,t5_2qh1i
t3_23q6ip,"What have your kids done to make you go WTF?","",14,20140422192834,AskReddit,t5_2qh1i
t3_23pmiu,"What are your lazy tricks?","",17,20140422160130,AskReddit,t5_2qh1i
t3_23qj8l,"What's Your Not So Super, Super Power?","",15,20140422214530,AskReddit,t5_2qh1i
t3_23qm89,"What's a ""one liner"" from a movie that gets you every time?","Mine always seems to be: ""You have a chance to do something I never had"". Just hits close to home.

Edit: include short clips of the movie if possible!",16,20140422221935,AskReddit,t5_2qh1i
t3_23q5f2,"What's a controversial topic you wanna know more about before taking a stance?","",16,20140422191708,AskReddit,t5_2qh1i
t3_23qjkp,"What is something you wouldn't buy the generic of?","Something that isn't worth going cheap on.",14,20140422214928,AskReddit,t5_2qh1i
t3_23qdah,"Which celebrity death would absolutely devastate you, even though you've never met that person?","",15,20140422204033,AskReddit,t5_2qh1i
t3_23qdcs,"Reddit, what do you LOVE about yourself? (serious)","",14,20140422204117,AskReddit,t5_2qh1i
t3_23pvgv,"Architecturally, what is the best designed food?","Tensile strength, crashworthiness,  modularity,  whatever. Define your own parameters and support.",14,20140422173006,AskReddit,t5_2qh1i
t3_23qnmx,"If you could have 500,000 of anything besides money what would it be?","",11,20140422223550,AskReddit,t5_2qh1i
t3_23q6lm,"If the countries of the world were edible, what would each one taste like?","Culinary stereotyping, you know the drill.",12,20140422192925,AskReddit,t5_2qh1i
t3_23qafk,"If you were given FULL CONTROL of the United states of America, What would you do?","Also, You dont have ot go through congress or anything like that, you can say anything, and it will be done.",13,20140422201007,AskReddit,t5_2qh1i
t3_23qrm7,"Reddit if there was a new STD named after your username, what would be the symptoms and how would it be treated?","",12,20140422232620,AskReddit,t5_2qh1i
t3_23qocl,"Growing up, what was the craziest thing you did in your parents' house that they never found out about?","",11,20140422224455,AskReddit,t5_2qh1i
t3_23qqxs,"What's the best way to eliminate political corruption in the United States?","I am writing a research paper on political corruption and how it can be eliminated (a topic stupidly chosen by myself), however, I don't know where to begin. 
Some information I have found is corporations will pay members of the house and senators to pass a bill in their favor, and the FDA is 'in bed' with pharmaceutical companies making it easier for them to get their products onto the market.
I would appreciate opinionated answers and sources on the topic as well.
Some questions that might be more to the point:

Where does corruption stem from?

Do checks and balances systems work? 

Is it possible to have a corrupt-free government/society or is that one of those ""only sounds good on paper"" situations?
",13,20140422231713,AskReddit,t5_2qh1i
t3_23qpom,"What seemed like a good idea at the time?","",14,20140422230145,AskReddit,t5_2qh1i
t3_23pw2w,"What is something others find odd about you, but personally you are totally ok with?","",13,20140422173629,AskReddit,t5_2qh1i
t3_23qcs5,"Reddit, what is one texture that makes you cringe every time you come into contact with it?","",12,20140422203508,AskReddit,t5_2qh1i
t3_23pt4e,"What small physical characteristic of a person makes you instantly not attracted to him/her?","",10,20140422170626,AskReddit,t5_2qh1i
t3_23q2ls,"Who is the most inappropriate/awkward person you've ever had a crush on?","",9,20140422184615,AskReddit,t5_2qh1i
t3_23q63b,"If you could poll the whole world, what would you ask?","",11,20140422192401,AskReddit,t5_2qh1i
t3_23q4dv,"What's something you shouldn't mention on the first date?","Update 1: Whoa! This blew up faster than I thought.  Thanks for some the most hilarious.....and seriously creepy responses! Keep them coming! ",10,20140422190610,AskReddit,t5_2qh1i
t3_23pn6m,"What moment in your life makes you cringe everyday when you think about it.","",12,20140422160804,AskReddit,t5_2qh1i
t3_23qp1h,"Reddit, whats the craziest one night stand you've had?","",11,20140422225354,AskReddit,t5_2qh1i
t3_23q316,"What is your number one rule in life?","",9,20140422185107,AskReddit,t5_2qh1i
t3_23qknf,"British people of reddit, what are some American snacks or candy that you've always wanted to try but can't get in your country?","My friend in London and I are exchanging packages with candy and snacks from our country. What are some things I should send over? ",11,20140422220130,AskReddit,t5_2qh1i
t3_23q9r0,"Drivers of Reddit, what is the scariest thing that's happened to you while driving?","",9,20140422200234,AskReddit,t5_2qh1i
t3_23qt2z,"What is it that people spend money on that you think is completely useless/stupid","",9,20140422234642,AskReddit,t5_2qh1i
t3_23q8cd,"Have you ever written or left a note to a stranger, what did it say, and how did it go?","",11,20140422194732,AskReddit,t5_2qh1i
t3_23qkzn,"What is an obscure, badass cartoon from when you were young that most people have forgotten?","",9,20140422220521,AskReddit,t5_2qh1i
t3_23qmg8,"What do you hate the most?","",9,20140422222206,AskReddit,t5_2qh1i
t3_23pzns,"What common comments, complaints or sayings on Reddit really piss you off?","",11,20140422181511,AskReddit,t5_2qh1i
t3_23qgvh,"Besides ketchup; what sauce do you like to dip your McDonald's French fries (or any french fry) in?","Anyone else out there like me who likes to dip French fries in pure honey? Don't knock it until you try it.",12,20140422211901,AskReddit,t5_2qh1i
t3_23qrhk,"Short people of Reddit, what's the best thing about being short?","I'm short, and I was thinking of all the cool things about being short, and I was wondering what other people thought. Cheers! :)",9,20140422232430,AskReddit,t5_2qh1i
t3_23q0o3,"What is something you do better with your non-dominant hand?","",9,20140422182613,AskReddit,t5_2qh1i
t3_23psil,"What foods have a healthier alternative that is better?","I thought of this question while eating my health nut GFs potato salad with cauliflower ",11,20140422170018,AskReddit,t5_2qh1i
t3_23q01n,"The last words you spoke aloud were the last words you spoke before you died. What were they?","",10,20140422181922,AskReddit,t5_2qh1i
t3_23pqsn,"If back to the future was set in 2015 and Marty traveled back in time to 1985, what car would be used instead of the DeLorean?","You know, like a Pontiac Aztec.",9,20140422164227,AskReddit,t5_2qh1i
t3_23q5gh,"If the leader of each country got super powers based on their country's stereotypes who would be the coolest?","Also, who would win in a fight?",9,20140422191738,AskReddit,t5_2qh1i
t3_23qcxy,"If all of Earth's history was a story, what is the biggest plot twist?","",10,20140422203646,AskReddit,t5_2qh1i
t3_23qoff,"what would your pet spend money on if it had an income?","",9,20140422224559,AskReddit,t5_2qh1i
t3_23qpyo,"What song emotionally overwhelms you when you hear it?","Why does it overwhelm you?",10,20140422230454,AskReddit,t5_2qh1i
t3_23qrnc,"What is the worst text you've sent to the wrong person?","",8,20140422232646,AskReddit,t5_2qh1i
t3_23qnj7,"What is a topic you like to discuss but have a hard time finding anyone to talk to about?","",10,20140422223430,AskReddit,t5_2qh1i
t3_23pxra,"What is something your SO can say to you while having sex that instantly makes it hotter. [nsfw]","I am terrible at talking dirty.",8,20140422175442,AskReddit,t5_2qh1i
t3_23qa2o,"What is the most entertaining audio book you've ever listened to?","",8,20140422200605,AskReddit,t5_2qh1i
t3_23qsk1,"How did you first discover reddit and what was your initial impression?","",9,20140422233921,AskReddit,t5_2qh1i
t3_23psra,"What's the manliest thing you've ever done?","",8,20140422170247,AskReddit,t5_2qh1i
t3_23popn,"[Serious] If money wasn't an issue, how would you spend your day?","",9,20140422162229,AskReddit,t5_2qh1i
t3_23qc2t,"Reddit: What is your text and/or ring tone?","",8,20140422202734,AskReddit,t5_2qh1i
t3_23q95n,"Who is your favorite redditor and why?","",6,20140422195627,AskReddit,t5_2qh1i
t3_23pw6t,"What are some of the most commonly misunderstood/misinterpreted/misrepresented facts on the internet","",9,20140422173752,AskReddit,t5_2qh1i
t3_23pzw3,"If you could only speak 5 words for the rest of your life, which words would they be and why?","",8,20140422181743,AskReddit,t5_2qh1i
t3_23qf1p,"Without naming it, what is one thing that you love and one thing that you hate about the country that you currently reside in?","",5,20140422205931,AskReddit,t5_2qh1i
t3_23px29,"Reddit, what is a fear you have that has helped you in life?","",5,20140422174702,AskReddit,t5_2qh1i
t3_23psp6,"In a world without morals, what sciences would advance the most?",#,7,20140422170212,AskReddit,t5_2qh1i
t3_23qlnl,"what is a TV series that you can watch time and time again and not get bored?","",7,20140422221253,AskReddit,t5_2qh1i
t3_23qfk9,"For those of you who have been admitted to a psych ward, what was it like and did it help? [Serious]","",8,20140422210505,AskReddit,t5_2qh1i
t3_23q26b,"What was the best or worst concert you've ever been to?","",7,20140422184142,AskReddit,t5_2qh1i
t3_23qqrx,"What was the funniest experience you've had explaining an idiom to someone who doesn't speak your language?","",6,20140422231504,AskReddit,t5_2qh1i
t3_23qjsm,"What is one conspiracy theory you believe?","",7,20140422215150,AskReddit,t5_2qh1i
t3_23qdl7,"Suddenly, all monetary forms of currency are worthless! What do you do to earn goods/services?","",7,20140422204358,AskReddit,t5_2qh1i
t3_23pynq,"What is your controversial opinion? [Serious]","",7,20140422180416,AskReddit,t5_2qh1i
t3_23pzo2,"Gamers, what is the hardest challenge you have come across in a video game?","",9,20140422181515,AskReddit,t5_2qh1i
t3_23qs4b,"Reddit, what is the most irrelevant and useless topic that you know a great deal about?","",7,20140422233300,AskReddit,t5_2qh1i
t3_23qlj3,"What is the absolute worst idea for a movie you can come up with?","This question was asked maybe a year ago and I still remember it as one of the funnest threads ever. I'm sure theres plenty more.",7,20140422221127,AskReddit,t5_2qh1i
t3_23qmru,"What do you believe is the worst way to die? (Serious)","",6,20140422222534,AskReddit,t5_2qh1i
t3_23q1ag,"What is something everyone loses?","",7,20140422183235,AskReddit,t5_2qh1i
t3_23pzsn,"Reddit, what is your favorite song to have sex to?","All genres welcome ",6,20140422181637,AskReddit,t5_2qh1i
t3_23qqn7,"In 25 words or less, what do you guess is general storyline (plot, climax, and conclusion) of a popular mainstream movie that you've never seen?","This will be more fun if you pick a movie that you honestly know nothing about aside from what you may remember seeing in trailers.",6,20140422231325,AskReddit,t5_2qh1i
t3_23qqgs,"What is the best way to learn a language without being immersed in it?","Im transferring to france for school in a couple years.... and everything i've googled talks about going somewhere where it is spoken, ok, im a student in Atlanta.... any help?",7,20140422231059,AskReddit,t5_2qh1i
t3_23qib2,"What's a reality you refuse to accept?","",7,20140422213449,AskReddit,t5_2qh1i
t3_23qpbq,"Reddit, how do I get over a fear of large flying insects?","I just killed a massive junebug on my porch because I couldn't stand it flying around, I was scared of it flying in my face or something. There's got to be some way of getting over this fear without killing every bug. I've traveled a lot, including to some tropical areas where huge bugs flying around at night are the norm - I'd like to continue going to remote places like that without being scared shitless of falling asleep. If any redditors have managed to get over a similar fear through exposure therapy, rationalization, etc., please leave a suggestion.",5,20140422225728,AskReddit,t5_2qh1i
t3_23q0j1,"Reddit, what is your perfect burger/cheese burger","",7,20140422182444,AskReddit,t5_2qh1i
t3_23q7mt,"Reddit, what is your favorite sense?","",8,20140422194012,AskReddit,t5_2qh1i
t3_23q3p7,"What's an album you can listen to a thousand times and not get tired?","In my case it's Bob Dylan - Blood On The Tracks. It's the only album I feel I could hear everyday and always love it. I always find something new in the lyrics and music. ",8,20140422185830,AskReddit,t5_2qh1i
t3_23q2i5,"What is your favorite pastry or baked item?","",5,20140422184503,AskReddit,t5_2qh1i
t3_23qf2n,"What one word would you use to describe your SO and why?","",4,20140422205949,AskReddit,t5_2qh1i
t3_23qq8c,"Reddit, do you have a reason to keep living? If so, then what is it?","Just in case:

/r/SuicideWatch 

/r/depression 

Suicide Hotline:
1-800-273-8255",6,20140422230808,AskReddit,t5_2qh1i
t3_23pza9,"90's Kids, what has our generation had or experienced that no other will appreciate?","It could be the way the world was, the technology that was around, your favourite TV shows, films or games or generally just any 90's nostalgia that you hold dear.
",6,20140422181116,AskReddit,t5_2qh1i
t3_23qnha,"What would stop you from buying an Electric Car?","Cost of car, cost of charging it, battery charge length, speed?... etc.",6,20140422223353,AskReddit,t5_2qh1i
t3_23pulu,"If you had a little angel and a little devil on each shoulder of yours, what would they say about what you are doing now?","",7,20140422172148,AskReddit,t5_2qh1i
t3_23pwf9,"Priests or religious figures of Reddit, when you say ""speak now or forever hold your peace"" has anyone actually said anything?","",8,20140422174009,AskReddit,t5_2qh1i
t3_23qdzo,"What's the most stress you've ever been under?","Not counting school.",5,20140422204816,AskReddit,t5_2qh1i
t3_23qqws,"Redditors who have called the cops on their neighbors, what happened?","",4,20140422231653,AskReddit,t5_2qh1i
t3_23q9u9,"Guys of reddit, what is the weirdest, NONSEXUAL thing a girl has ever said to you?","This requires some thought for most guys since obviously some of the weirdest things you can hear are sexual in nature, but the answers are usually funny.

Example: I was making out with a girl once, and her stomach started growling. It kept up for a period of time, so I stopped and asked her if she was hungry and wanted to grab something to eat. She replied, ""No I'm fine. I just ate a lot of peanut butter earlier, and my stomach always growls when I eat peanut butter."" ",6,20140422200337,AskReddit,t5_2qh1i
t3_23q84z,"What is the most perverted way you can describe something completely innocent?","",7,20140422194528,AskReddit,t5_2qh1i
t3_23qdix,"What's something about college life that most people believe to be true but in reality is wrong?","",5,20140422204313,AskReddit,t5_2qh1i
t3_23pt5c,"[Serious] Despite Religion, what do **you** think happens after death?","",6,20140422170645,AskReddit,t5_2qh1i
t3_23qnlk,"If you could make a ten second speech to the entire world... What would you say?","",7,20140422223516,AskReddit,t5_2qh1i
t3_23q6pg,"I am substitute teaching for the first time tomorrow and I'm nervous! Can any teachers/substitutes/students off some advice to calm my nerves?","",5,20140422193019,AskReddit,t5_2qh1i
t3_23qh7w,"What's something you now understand that you didn't when you were younger?","",5,20140422212322,AskReddit,t5_2qh1i
t3_23pqjb,"What is a good team name for bar trivia tonight?","Hey everyone!  Looking for a good team name for trivia tonight.  It can be as disgusting as you want it to be.  Thanks!",3,20140422163948,AskReddit,t5_2qh1i
t3_23qg1d,"My 9 year old brother has been getting teased for being weird (he's quiet and likes science), who are some real weirdos who have gone on to be awesome?","",5,20140422211017,AskReddit,t5_2qh1i
t3_23qt3s,"What is one instance where a commercial on TV has actually convinced you to purchase a product?","",3,20140422234708,AskReddit,t5_2qh1i
t3_23pnvz,"Former or current doctors and nurses of Reddit, what has been the most tragic/heart-wrenching scenario you've been in whilst at your job?","",4,20140422161449,AskReddit,t5_2qh1i
t3_23pzy7,"In America it's common to see ethnic groups participate in ""stereotypical"" jobs (i.e. - Vietnamese or Koreans at nail salons, Indians at 7-11 or Motels, Eastern Europeans at mall kiosks, etc.). What jobs are Americans known for having when they group in other countries?","I feel like my question is poorly worded, but hopefully you all get what it is that I'm asking. ",5,20140422181822,AskReddit,t5_2qh1i
t3_23pn5s,"How is your day?","",5,20140422160751,AskReddit,t5_2qh1i
t3_23pvmu,"Reddit, What's the coolest thing I can buy online for $10","",5,20140422173157,AskReddit,t5_2qh1i
t3_23q227,"What is the nicest thing anyone has ever done for you?","",7,20140422184025,AskReddit,t5_2qh1i
t3_23qg7i,"What is the funniest pick up line that you know?","",3,20140422211203,AskReddit,t5_2qh1i
t3_23qfqq,"If walls could talk which walls would have the best stories to tell?","",3,20140422210701,AskReddit,t5_2qh1i
t3_23qhri,"Have you ever pulled a prank on someone but never revealed it was a prank?","And the person still doesn't know?",6,20140422212932,AskReddit,t5_2qh1i
t3_23px5s,"Mentally disabled people of Reddit, what is a misconception about you that you would like the rest of the world to know?","",6,20140422174813,AskReddit,t5_2qh1i
t3_23qtdo,"What's one weird unique thing you do with you SO that other couples don't do?",.,5,20140422235131,AskReddit,t5_2qh1i
t3_23qb4n,"What is the worst thing you have done in your life?","",4,20140422201724,AskReddit,t5_2qh1i
t3_23q1xz,"Got all 4 wisdom teeth and 2 molars pulled. Gonna kick back. Movie suggestions?","Relaxing the next few days...Any cult classic, non-mainstream movies worth watching you can suggest? Appreciate it.",3,20140422183919,AskReddit,t5_2qh1i
t3_23q2n1,"What's the best case of ""OP delivers"" on Reddit?","",2661,20140422184637,AskReddit,t5_2qh1i
t3_23q2n1,"What's the best case of ""OP delivers"" on Reddit?","",2654,20140422184637,AskReddit,t5_2qh1i
t3_23q2n1,"What's the best case of ""OP delivers"" on Reddit?","",2653,20140422184637,AskReddit,t5_2qh1i
t3_23ppr3,"TIL You can cough your Diva Cup out","I'm mortified. I've caught a terrible chest cold and needed to go the pharmacy for some cough syrup. Since it's a terrible day it would only make sense that I'd start my period, so I put in my Diva Cup and went to go wait in line for my codeine cough syrup. 

Well, I'm coughing uncontrollably and all of a sudden I feel my Diva Cup moving. I can't stop myself from coughing so now I'm trying to not attract attention (impossible when you sound like you have TB) and putting my hands in my jeans pocket so that every time I cough I can push the stem back up. It was halfway out of my body while I waited for the pharmacist. 

It's too vulgar to tell anyone. Just you guys. ",751,20140422163217,TwoXChromosomes,t5_2r2jt
t3_23pplb,"Why Mindy Kaling — not Lena Dunham — is the body positive icon of the moment",http://theweek.com/article/index/260126/why-mindy-kaling-mdash-not-lena-dunham-mdash-is-the-body-positive-icon-of-the-moment?utm_source=links&utm_medium=website&utm_campaign=facebook,100,20140422163037,TwoXChromosomes,t5_2r2jt
t3_23psjo,"Found out I am pregnant, will be getting a medical abortion tomorrow. Feeling so much sadness.","I found out yesterday that I am pregnant and I'm still in shock. I've been with my boyfriend for three years and we've never once had a serious scare so this completely took us by surprise. 
I am very close with my friends and family but I have a feeling that I would experience disappointment and judgement from them if I told them what I was doing, even though I'm certain most of them are pro-choice.
The struggle is that I am 23, in a stable relationship, and finished school so it seems like I am someone who could potentially raise a child. But I'm not in a position in the least to be a mother. I have no money, my boyfriend has massive amounts of debt, we're both pursuing artistic careers and having a child would shatter us.
My boyfriend has been really supportive and has been my shoulder to cry on (multiple times) since I found out. I guess why I'm posting though is that I still feel lonely, nervous and especially am fearing how this will affect me for the rest of my life.
Any words of encouragement, or personal experiences would be so appreciated.

",42,20140422170033,TwoXChromosomes,t5_2r2jt
t3_23qj3z,"Just need to vent. My privacy was violated pretty strongly :(","I'd been talking to one of my cousins, and she's been having a hard time with life. I thought I'd share some of my rough growing up (Childhood trauma/ ptsd/ rape / etc) to reach out and connect with her. 

Turns out her parents read all of her messages, so now my aunt/uncle know all this shit on me, that I never intended them to know. 

Ugh. 

I'm 26, she's 18, for more of a frame of reference.

I'm just so frustrated, not only are they invading her privacy - but they've invaded mine as well. Now I don't even feel like I can reach out to her anymore, because everything I say will be read by lots of people, and I really don't need that kind of shit in my life. 

Grr.",35,20140422214408,TwoXChromosomes,t5_2r2jt
t3_23qm05,"After Five Years Of Fighting, Teen Girl Makes Gender Changes A Reality In McDonald's Happy Meals!",http://perezhilton.com/perezitos/2014-04-22-teen-fights-mcdonalds-happy-meal-gender-based-toy-options#.U1b3wFflrpB,12,20140422221659,TwoXChromosomes,t5_2r2jt
