postID,postTitle,postBody,postScore,postDate,subredditName,subredditID
t3_23s966,"Tennessee Making Pregnancy Outcomes a Crime - Why You Should Care and How You Can Help","Tennessee's General Assembly has passed a law that would make women [criminally liable for the outcomes of their pregnancies.](http://rhrealitycheck.org/article/2014/04/10/tennessee-legislature-passes-far-reaching-bill-make-pregnant-women-criminals/) The bill targets women who use narcotics illegally during pregnancy, but is written so broadly that any pregnancy loss thought to be connected to an 'unlawful' act can be grounds for investigation, arrest, and prosecution. This means that anyone who has a miscarriage at any time in pregnancy or gives birth to a baby with health problems can face criminal investigation. The penalties are assault charges, which can carry up to 15 years in prison. 

This is bad business for a lot of reasons. 
* It is [meanspirited and counterproductive](http://www.nytimes.com/2014/04/17/opinion/criminalizing-expectant-mothers.html): women who struggle with addiction need health care, not handcuffs. 
* [Medical experts recognize](http://www.acog.org/Resources_And_Publications/Committee_Opinions/Committee_on_Health_Care_for_Underserved_Women/Substance_Abuse_Reporting_and_Pregnancy_The_Role_of_the_Obstetrician_Gynecologist) that the threat of prosecution actually hurts babies by driving women away from prenatal care.
* The law will [disproportionately punish black women] (http://rhrealitycheck.org/article/2014/04/17/tennessees-pregnancy-criminalization-law-will-hit-black-women-hardest/), who are more likely to be blamed for their pregnancy outcomes. 
* Prosecutors claim that *only* addicted women who don't seek treatment will be arrested, and they will *only* be charged with a misdemeanor. But [nothing in the law](http://www.salon.com/2014/04/21/you_cant_always_trust_people_to_do_the_right_thing_how_a_law_split_pro_life_gopers_in_tennessee/) limits it in this way. 

Prosecutors and police shouldn't have a place in pregnancy: this is the first time a state has passed a law that gives them an in. 

The bill is currently awaiting Governor Bill Haslam's signature. Groups are circulating a petition [demanding that he veto the law.](http://action.rhrealitycheck.org/page/s/gov-haslam-veto-pregnancy-criminalization-sb-1391)  I hope you will sign, and I would also appreciate your suggestions as to where else I might post. ",13,20140423124756,TwoXChromosomes,t5_2r2jt
t3_23rrnl,"""I'm 33 and Single. What am I Doing Wrong?""",http://www.theawl.com/2014/04/all-the-single-ladies,10,20140423095248,TwoXChromosomes,t5_2r2jt
t3_23sbxs,"What's the most embarrassing thing your SO has walked in on you doing?","I had my super awesome noise-cancelling headphones on while working, and was singing and chair-dancing away, when I noticed my hubby's face  in the mirror above my desk.  Not sure how long he'd been standing behind me, but it was long enough for him to get a good show.  Got me wondering what cringeworthy things your SO has walked in on you doing?  I'm sure I have way more embarrassing stories but this is the most recent :-)",8,20140423131353,TwoXChromosomes,t5_2r2jt
t3_23sdgj,"DAE have to deal with casual sexism in their hobby(ies)?","I collect records, and have been for a few years. Nobody has a problem with it, every one encourages it. Except for a vast majority of male record store clerks.

 I don't know what it is, but they almost always assume that my purchases are for a male, or are my male companions. When I explain they are mine, I get a lot of comments like ""Well, that's strange for a girl"" or ""You must be getting this for the cover art."" Just what. I just want to purchase my vinyl without your petty sexist comments, ugh.

Edit:  fixed a typo!",6,20140423132816,TwoXChromosomes,t5_2r2jt
t3_23rx22,"Expat Trailing Spouse resenting marriage. Super lonely!","Hi Ladies, 

I moved to Italy with my husband in September.  He is pursuing his postdoc.  I am an engineer, and am working remotely.  The whole thing fell apart.  We got married like 4 days before we moved out here, which was incredibly stressful and ridiculous in its own right, and I was supposed to work at the European site here.  When I got here, they gave some bla bla work visa excuses that my company was supposed to work out but didn't.  Several conversations and weeks later, they asked me to just work ""from home"".


It is so hard.  It has been 7 months and it is not going well.  I am a huge extrovert and my husband is the only person I talk to.  We have some friends yeah, but they are his office buddies.  My whole identity is warped now that I'm married. I'm essentially a stay at home wife.     I have not bothered to learn Italian, I just don't even give a shit.


My job is only letting me do this for one year so I have to go back in September.  I would have gone back by now but I was trying to make it work, and people are coming to visit and I didn't want to disapoint everyone.  We have this stupid picture perfect sounding life - moving to Italy and I get to work my breadwinning job from here - fuck me, its anything but.  My job has unravelled, I get menial tasks, most of the time I don't do anything but stay logged on until I get an email.  I used to be a heavy hitter - now I'm just a name on the org chart.  I've addressed this with my boss but not much has changed. I have been considering changing careers when I get back in Sept, have been considering divorce, I am just not happy.  To be honest, I am more important to myself than my relationship is to me.  I probably should not have gotten married and came out here.  We had been dating 8 years and rushed the wedding when we found out he got the position.


I just need to vent. Today was especially bad for me.  We went on a great trip this weekend but today is our first full day back and my despair hit me like a ton of bricks.  I am so lost. I know when I go back to the US I'll fall into another depressive episode and feel like this was a wasted opportunity that I slept through.  I used to be so loyal and gung ho about my job - why bother to work so hard if they couldn't even back me up this year.  ",5,20140423104841,TwoXChromosomes,t5_2r2jt
t3_23sq23,"I get up early. I get yelled at. I get little pay. Memoirs of a first-year, inner city teacher.",http://www.projectava.org/i-get-up-early-i-get-yelled-at-i-get-little-pay-but-i-love-it/,7,20140423152549,TwoXChromosomes,t5_2r2jt
t3_23sfoh,"Diva Cup... am I even doing it right? Help...","Hi! I live in Belgium and came across the Diva Cup online. A few months later I came across a little shop here that sells it and bought one. the lovely salesperson explained it all. I read the manual fifteen times.

I just got my period and I got the damn thing in easily enough, which was a surprise. However, i'm unsure if I did it right, haha. 

I folded it in the C-shape and got it in, but I can't turn it. there's still a bit of C-shape left while it's in. so i'm not sure it's 'sealed'? i heard a 'fwomp' sound. I've done this trice now, after two-ish hours, taking it out (I'm home right now, haha) and putting it back in. 

Taking it out is proving weirdly difficult, since the cup seems to.. err.. migrate up? it's still in straight and doesn't leak (the outside looks clean and there is stuff inside) but it's very far up, so it's hard to grasp it and take it out.

am I doing it right? it'll get easier with practice I'm sure and i don't feel it in there, but I'm afraid that if i leave it in for, say, six hour, it'll migrate further and i won't be able to get it out! 

advice very welcome, ty. ",3,20140423134915,TwoXChromosomes,t5_2r2jt
t3_23s25l,"In what world does the abuser leave the victim?? I am having trouble figuring out why this happened & feel like the only one who went through this.","I keep hearing about how abusive relationships are so hard to get out of because the man sweet-talks the woman and begs her to come back. Or at least that's how I THOUGHT it went.

I was in a year long relationship with an emotionally, mentally & physically abusive boyfriend. We threatened to dump each other all the time and the other would beg not to. In the beginning it was me dumping & him begging, but at the last part of it it was the opposite. He controlled, manipulated, and played mind games. I was wrapped around his finger & blinded by, what I thought was, love.

The night we broke up, he was super black out drunk & he decided to beat me because I was crying (that's literally the reason) 
I thought in most situations the guy would hit the girl then feel really bad afterwards and apologize only to do it again in the future; but he didn't stop. He kept punching, kicking, throwing, slapping me. He took my windpipe, looked me in the eye with a look like a demon had possessed him, and suffocated me twice. The last time I fell to the floor passed out.
He tried to leave but for some reason I still cared about him (I still cant figure out why) He said ""fine but I'm leaving in the morning"" & we both pass out.


I wake up next to him. He was laying facing away from me. I was in so much pain. My eye was throbbing and disgustingly bruised. I choked out, ""babe...are we still together?"" He leans over, looks at my eye & said ""Oh God"" He then jumped out of bed and started immediately packing his stuff. I was crying so hard asking why he was leaving, begging him not to. That I needed him (so I thought). He seemed like he was sad and he kept saying ""I have to.""  He then sits down and starts crying with me. He tells me ""he loves me and always will."" and we hug for the longest time. Tells me he will still pay his part of the rent. He then gets up, tells me he loves me, gives me one more hug and leaves me there to wallow in sadness, pain & emptiness.


The next day he told me we were just ""on a break"" and can ""try again"" when he ""gets his shit together."" After that day though he changed his mind and said we could never be together again, but could still be friends and hang out. Why was I the one begging him, when he had hurt me so bad? A week after all this, he calls me up crying saying he had gotten in the car and just drove & drove. Didn't know where or for how long but ended up like four states away. Told me he was scared and thinking about killing himself. I was stupid and still cared about him. I wired him money and we were talking like we were in love again that day. Was he manipulating me or did a part of him really become scared and looked to me for help?


The next two weeks after the incident we are talking. He seemed extremely depressed too. His father was abusive to his mother for like.. 10 years, and I guess he was upset that his father came out in him, because it seemed like he didn't want to become him. But then why did he? He used to cry about his dad so much in the first few months in our relationship. He was so sensitive and remorseful for being mean to me. Grieving for his lost childhood his father robbed him of. Then the last couple months between us, something in him snapped. He was so, angry at me. All the time. No matter how good I tried to be to him. He wasn't the guy I fell in love with, he had become a monster and I'm not sure why or what happened. Im not saying I was the perfect girlfriend, I have made a few mistakes, but I didn't treat him like he treated me. I put way more energy, time, and feelings into this guy than anyone ever has, despite how he acted towards me.


No matter how much I think about it I can't figure out what happened in his head. Did he care about me and just let his demons take over or did he never care & just use me for his own personal gain? When he was beating me he told me he ""stopped loving me a long time ago."" & truth comes out when you are drunk. But if he did, why did he keep coming back when I begged him not to dump me? I mean, he did do a few things for me..He called the ambulance for me when I drank to much, projecting vomit, and spent the night waiting at the hospital for me. He bought me some gifts when I caught him doing something and took me out to eat. Just all the negatives outweighed the positives. But did he care about me or not? Why did he cry and act depressed when we broke up? Only to start treating me like less than dirt again? 


I think he was either bipolar, borderline personality or something along those lines. My therapist says that they are addicted to power and control & leaving is maybe a way they still have control on you because you are begging for them back. But when they leave they wont be able to have power over me anymore to satisfy their hunger. I can don't understand all this. 


Can anyone shed some light on the situation? I am having trouble swallowing the fact that I wasn't even strong enough to leave him. I was BEGGING for my ABUSER to come back to ME. 
WHY?????????
He took that satisfaction away. It was insult to injury, a slap in the face. (Literally) I just *can't* understand why. He was so cruel, but acted remorseful and ran away.


(P.s. I am in the process of pressing charges in case you are wondering. & I am so better off without him. Hes in jail and dead to me. I will never want to have contact with him again.)


Any knowledge on this subject is appreciated. Xoxo.


TLDR: What possible reason could possess my abusive boyfriend to leave ME after he beat & almost killed me? Why was I begging for him back and not the other way around?

EDIT: Might I add he had very large sad eyes when I glared at him in court while I gave my testimony. He looked scared and hurt. I was expecting him to look angry but it was mostly of disappointment it seemed. My mom tells me he probably is remorseful, but I have a hard time agreeing. She also mentioned that he probably knew his father was in him, but just couldn't suppress it any longer and is sad it came out and hurt me. Looking back on some old text messages she might be right. One read, ""It scares me when I yell at you like that because I don't want to lose control, I don't know what I'm capable of."" Showed it to my mom & she said, ""Yeah, he knew.""

Before when we still talked he did apologize a bunch of times and told me he left because ""he didn't want it to happen again"" But why do you suddenly care about me right after you beat & break me? With all the mind control, manipulating and lying hes fed me, its no surprise that I am seriously confused and don't know what to believe. With all these mixed messages and signals.",4,20140423113929,TwoXChromosomes,t5_2r2jt
t3_23saeu,Lunapads,"Has anyone ever used Lunapads? http://lunapads.com/bestsellers.html

I'm interested because a. pads and tampons are expensive b. they're better for the environment c. my skin is super sensitive.

Any experiences to share? How do they work?",2,20140423125922,TwoXChromosomes,t5_2r2jt
t3_23rpna,"Does/Has anyone else felt like this? (Silencing the Self Scale)","Someone showed me this scale yesterday - http://faculty.wwu.edu/djack/resources/STSS_Scale.pdf and it seems like I max out many of these items. I understand logically that I do not have to feel this way. It causes me extra stress and leads to neglect for my own self-care. 

I [24F] am a graduate student so there's a lot on my plate with that. I recently (~2 months) got into a relationship with a great guy and don't want to fall into the same patterns.

Does or has anyone else felt like this before? 
Did anyone used to be like this, but changed? If so, what steps did you take?",4,20140423093052,TwoXChromosomes,t5_2r2jt
t3_23ssqq,"Unplanned pregnancy. Very conflicting emotions and thoughts.","Sorry for the long post. I am very conflicted. I am 25 years old, and I have never thought I wanted children of my own, but suddenly this year it's like the mommy hormones finally kicked in, and lots of my friends are pregnant or have had their first kid, and my stupid body is going ""babies! Let's make babies!"", and my logical brain is like ""what is this"" …. And now I'm fucking knocked up and really confused about what I really want. 
I had an abortion at 16, and never thought it would happen again unplanned, yet here I am. That experience was heartbreaking and I really don’t want to go through it again. I am not in an ideal place in my life for a child - the father is my ex that I keep hooking up with because the sex is amazing and I do care about him a lot, but he is virtually homeless and jobless right now, due to really bad financial and business management coupled with severely debilitating depression and untreated OCD. In short, not someone I can count on.
I, on the other hand, have a really excellent job that pays very well and I have full benefits, I rent my own home, but I am still getting back on my feet (about $9k in debt not including my car or student loans) after being un or underemployed for two years. I am in a better place than a lot of women in my condition, but I still don’t think I could handle raising a child right now. 
I have thought a lot about adoption, but that brings up a lot of issues for me too. Could I handle that? After nine months and hours of pain in labor and birth, could I really give my amazing creation away, even if I had an open adoption? I was adopted, and I don’t see or talk to my bio mother, even though we did connect a few years ago (it was a closed adoption). Will my baby grow up to not want to see or talk to me? Will it be easier that way or to see him/her grow up with another couple? 
Also, I am so afraid of losing my pre-baby body. And (I know I shouldn’t care) but what will my coworkers and friends think, how will they react? I am atheist now, but I was raised Catholic, so those feelings of guilt are kind of hard wired into my brain. 
I also feel really lonely in this decision. I am not close to my mother so that’s not even an option of telling her until I actually make a decision (and only if it's not abortion). My father and I don’t talk about this kind of stuff lol. I'm not close to most of my blood family anyway, my family is the community of friends I have built around me, but even then, I would feel ashamed to tell most of my friends, even really close ones. The only person I feel totally comfortable talking to is my ex, the father, but he makes it really difficult because he's still completely in love with me. I know he will support whatever decision I choose, but I still wish I felt comfortable with other people to talk about this with. 
I don’t know if I'm really asking for advice or anything. I just feel really confused and conflicted and sad that this happened right now, at a really inconvenient time in my life. I don’t want to have an abortion, but I don’t like the other options any better. Sigh. 
",1,20140423155103,TwoXChromosomes,t5_2r2jt
t3_23si91,"Please help with a small job interview in 3 hours!!","I was just told that I need an interview to work at a small tea house place. It is my first job as I am still a teenager. I don't know how I am supposed to dress or what they will ask me. 

I am pretty sure there is a subreddit for these type of questions but I don't know of it. The interview is in 3 hours and if I would have known about it earlier, I would have posted before. Help!!",1,20140423141349,TwoXChromosomes,t5_2r2jt
t3_23sk7f,"Does this sound like ovulation pain? Slight TMI.","For the past couple of days I have had slight pinching pain on my left side. It is sort of near my hip bone. It really isn't painful, just annoying. It has been about two weeks since my last period. This week I have noticed after a bowel movement I have had clear, stretchy discharge. I figured I was getting ready to ovulate. Is this pinching sensation normal during ovulation? ",0,20140423143139,TwoXChromosomes,t5_2r2jt
t3_23sclq,"Why I Stopped Talking About What Happened - And Why I'm Changing That",http://www.huffingtonpost.com/grace-brown/why-i-stopped-talking-about-what-happened_b_5186175.html,0,20140423132006,TwoXChromosomes,t5_2r2jt
t3_23s3n8,"Should I have been to see a Gyno by now?","I'm 18, female and sexually active. I've had the implant for a little over a year now and it's been giving me problems (bleeding light constantly for 3 months, then recently I've had three very heavy periods a week apart). I've seen 3 GP's about the issues with bleeding and they've all put it down to the implant and hormones. I was given Mefenamic acid to help which made the bleeding worse.

I've never been told that I should see a gyno/ been referred, but from a google/reddit search it seems to be quite an important thing to do when you become sexually active/ go on BC.

Now I'm experiencing pain during sex. I'm going to make an appt with my GP but I'm just worried/annoyed and I assume he'll just put it down to the implant again and it'll never get sorted.

I'm from England, so NHS & I'm not sure if I can contact a gyno directly.

Should I press to be checked by a gyno to make sure everything's ok or am I being silly?",0,20140423115449,TwoXChromosomes,t5_2r2jt
t3_23ppr3,"TIL You can cough your Diva Cup out","I'm mortified. I've caught a terrible chest cold and needed to go the pharmacy for some cough syrup. Since it's a terrible day it would only make sense that I'd start my period, so I put in my Diva Cup and went to go wait in line for my codeine cough syrup. 

Well, I'm coughing uncontrollably and all of a sudden I feel my Diva Cup moving. I can't stop myself from coughing so now I'm trying to not attract attention (impossible when you sound like you have TB) and putting my hands in my jeans pocket so that every time I cough I can push the stem back up. It was halfway out of my body while I waited for the pharmacist. 

It's too vulgar to tell anyone. Just you guys. ",749,20140422163217,TwoXChromosomes,t5_2r2jt
t3_23pplb,"Why Mindy Kaling — not Lena Dunham — is the body positive icon of the moment",http://theweek.com/article/index/260126/why-mindy-kaling-mdash-not-lena-dunham-mdash-is-the-body-positive-icon-of-the-moment?utm_source=links&utm_medium=website&utm_campaign=facebook,100,20140422163037,TwoXChromosomes,t5_2r2jt
t3_23psjo,"Found out I am pregnant, will be getting a medical abortion tomorrow. Feeling so much sadness.","I found out yesterday that I am pregnant and I'm still in shock. I've been with my boyfriend for three years and we've never once had a serious scare so this completely took us by surprise. 
I am very close with my friends and family but I have a feeling that I would experience disappointment and judgement from them if I told them what I was doing, even though I'm certain most of them are pro-choice.
The struggle is that I am 23, in a stable relationship, and finished school so it seems like I am someone who could potentially raise a child. But I'm not in a position in the least to be a mother. I have no money, my boyfriend has massive amounts of debt, we're both pursuing artistic careers and having a child would shatter us.
My boyfriend has been really supportive and has been my shoulder to cry on (multiple times) since I found out. I guess why I'm posting though is that I still feel lonely, nervous and especially am fearing how this will affect me for the rest of my life.
Any words of encouragement, or personal experiences would be so appreciated.

",40,20140422170033,TwoXChromosomes,t5_2r2jt
t3_23qj3z,"Just need to vent. My privacy was violated pretty strongly :(","I'd been talking to one of my cousins, and she's been having a hard time with life. I thought I'd share some of my rough growing up (Childhood trauma/ ptsd/ rape / etc) to reach out and connect with her. 

Turns out her parents read all of her messages, so now my aunt/uncle know all this shit on me, that I never intended them to know. 

Ugh. 

I'm 26, she's 18, for more of a frame of reference.

I'm just so frustrated, not only are they invading her privacy - but they've invaded mine as well. Now I don't even feel like I can reach out to her anymore, because everything I say will be read by lots of people, and I really don't need that kind of shit in my life. 

Grr.",33,20140422214408,TwoXChromosomes,t5_2r2jt
t3_23qm05,"After Five Years Of Fighting, Teen Girl Makes Gender Changes A Reality In McDonald's Happy Meals!",http://perezhilton.com/perezitos/2014-04-22-teen-fights-mcdonalds-happy-meal-gender-based-toy-options#.U1b3wFflrpB,10,20140422221659,TwoXChromosomes,t5_2r2jt
t3_23qo8d,"Sigh I need some cheering up, I sure don't feel like a woman...","Hey all I've posted here once or twice, I'm a 29 yr old mtf transgendered girl.  I've been on hormones for a very short time, and I'm living in this limbo now that is so depressing.  A few ppl know about me, most don't, work doesnt, and I want to jump into femininity so badly but I just can't yet.  Not to mention now I'm changing physically so I certainly don't look super manly but not yet female either. 

I'm so worried about passing and being too tall, having feet too big, having a voice too deep, yet I want to just go out and be myself so much.  I wish I had the confidence to not care what ppl think but, we all do you know?  and its hard when youre going through a 2nd puberty essentially!

Cheer me up everyone :'(",7,20140422224330,TwoXChromosomes,t5_2r2jt
