postID,postTitle,postBody,postScore,postDate,subredditName,subredditID
t3_23pxgq,"Rant: no one takes my anger seriously","Whenever someone's doing something that makes me outwardly frustrated, angry, or annoyed, they have a tendency to metaphorically pat me on the head and comment on how ""adorable"" it is when I'm angry. It's probably because I'm short and conventionally cute I guess, but I don't really get how petite-ness transfers into not having real emotions?? Just because my frustration is ""cute"" to you doesn't mean that I'm not actually angry... And sometimes my family thinks it's funny to get me all riled up about something (I'm usually pretty calm) and then brush it off, even though they actually genuinely changed my mood and played around with my feelings & it's hard to bounce back from that to cheerful conversation. I guess there's something about being a more emotionally reserved person so that when I do show emotion, it can be more entertainment than me actually having feelings.

I don't know. I'm angry and no one will believe me, so I'm writing about my feelings on the internet instead of talking about them IRL. Ha, take that family & friends.",2,20140422175121,TwoXChromosomes,t5_2r2jt
t3_23qjfq,"My boyfriend is an idiot and as a result everyone now thinks I'm an idiot!","Last week my boyfriend suffered a concussion whilst horsing around and wrestling with a friend. He knocked himself unconscious and terrified both the friend and those around him. He claimed to be ""fine"" the day of but started experiencing severe headaches and nausea the next day, so we went to the hospital. We are still waiting for a CT scan but he's been officially diagnosed with a concussion and was advised to take it easy.

However, he hasn't. He owns and coaches at a gym which he hasn't taken any time off of but can be easily modified to keep him safe. However, he also still insists on working out although he claims to have ""modified"" the workouts to be less stressful to his head. He's still pushing himself pretty intensely to the point where he's very dizzy or throws up after workouts despite doctors orders.

I've told him about a million times that I'd like him to stop working out. Pretty much everyone in his circle of family and friends has told him this. He initially did try to stay off his feet but said he felt ""fine"" and was back at it after not even a day of rest. He's convinced himself that the positive benefits of exercise are somehow actually good for his potential brain energy and that he's modified things enough to be okay. 

I'm really worried about him, especially as his CT scan is still days away and he has worsening symptoms following exercise. On top of that, I'm also pretty mad at him as well for being so stupid and careless with his health. Part of me feels guilty for even being mad about it, since it is his body and his choice. 

Furthermore, all of our family and friends not only think he's an idiot but have now started seeing me in a negative light as well. I've heard behind my back how I'm an idiot for not ""making him stop"" and for ""putting up with his idiocy"" from his siblings and even from my own!

Anyone have any advice here? I've tried talking to him (and yelling at him!) and it doesn't seem to be getting through. Dealing with my worry and anger as well as external pressures from our friends and family has left me even more exhausted and I find myself suffering from terrible insomnia. I check on him throughout the night, especially when he comes home from the gym because I worry I'll wake up one day and he'll have died in his sleep!

TL;DR: boyfriend has a concussion but is still exercising against medical orders. How do I get through to him??",4,20140422214745,TwoXChromosomes,t5_2r2jt
t3_23qo8z,"A father has some strong words to say about the gatekeeping of women in geek culture","http://ipad.themarysue.com/themarysue/#!/entry/greg-rucka-has-something-important-to-say-about-your-gatekeeping,5356aed2e56d0bb8535b3680",3,20140422224341,TwoXChromosomes,t5_2r2jt
t3_23qqqm,"HELP! I'm upset about my job!!","Sorry in advance if this is the wrong sub (if is it not, please redirect me) I will try to make this as short as possible. 

I am a 19 year old college freshman in a small town and have had my first job for about 6 months now. It is a small 5 employee print shop, with two mid 30 year old women and another college female, with me being the newest one. I have recently been noticing that I am beginning to do more of the ""physical"" work including changing air filters, repairing machines, cleaning out offices, moving boxes, etc. My official job title is Customer Service/Production (as I deal with the customers and prepare the jobs). The reason I got this job was with the help of the other college aged worked who has been here for a year and a half. 

Let me also state that I have no intention of staying in this job because I will be moving away out of town for a university by fall of 2015 at the latest to pursue a Mechanical Engineering degree, which my boss, a 50 year old male has. I have a sense that just because I want to be an engineer, he puts me to do the ""manly"" jobs and doesn't want to bother the other 3 who do design work because of their degree. Also, when the other workers are supposed to be working, I see them on their phones (especially the college girl) and when I walk into the office she pretends she's back to working. This has infuriated me to the point that I want to quit because it is not fair that I am doing the dirty jobs while she sits behind a desk ""working"". 

With that being said, there is a new opening as a secretary in town and think it is right for me to experience a new job. My question is, how do I tell my boss I want to quit. Should I go ask for information about the new job and if I get through the interview process and hopefully get hired, do I tell my boss then and put in a 2 weeks notice. This is the first time I have dealt with a situation like this. 

P.s earlier in the year, I decided not to pursue an engineering intership because I felt like the ""company"" needed me, but I now see that the only need they want is my ""physical and engineering help"" 

TL;DR I am having issues at work with how I am being assigned to do the ""physical and dirty"" work in the print shop while others are barely working in an office designing. There also is an opening as a secretary in town. Should I go ahead and see what happens?",0,20140422231441,TwoXChromosomes,t5_2r2jt
t3_23q5qe,"Girlfriend about to start taking birth control, I remember reading in the past about there being lots of negatives...","Is that true? It has been a long time but I think I remember reading about sex drives dropping, acne sky-rocketing, depressing occurring, and these things never ever going away. I read these were permanent... I think it was redditor comments. 

Soo... any truth? 
",0,20140422192030,TwoXChromosomes,t5_2r2jt
t3_23qda3,"My boyfriend isn't going to my senior prom with me, and I'm still upset about it after 2 months of knowing.","Sorry, long story:

I've been dating him for 2 1/2 years, and was super excited about going to the dance. We didn't go to Homecoming this year because we knew we were going to prom. I mean, I feel like the dance itself is not that important. Why should it be a big deal to me?  But then I think about my dress, and how I get to look my best and dance and have fun. I had already bought my dress when he dropped the news.  See, he is on one of a couple of extracurricular teams that placed in state, and are going to nationals in Washington D.C.   Awesome, right? Well it was, until I found out that prom and that trip were on the same day.

But the thing is, is that the trip is optional. He is not required to go, in fact, some of the seniors on other teams aren't going because of prom.  I just feel so guilty, though, because don't want to be the thing that keeps him from enjoying this. When he told me about not coming to prom... I started sobbing right there. I don't know why I'm still so upset over it, that was over 2 months ago but every time i see a guy asking a girl to prom I just start tearing up. Because now I don't get to be with my best friend at prom, I don't get to experience being asked, it just hurts.  

We talked about it, and I told him how bad it made me feel.  He knows I was crying almost every night.  But in person, when I finally got him to sit down and talk about it, I told him how I wanted to feel important enough to him to pick me over going to his competition.  After that he got this weird look on his face.  I asked him why he looked so conflicted, and it was because he was about to break up with me because he was causing me so much pain, and felt like he couldn't make me happy anymore.  Which, he had tried to compromise by saying the whole ""We can have our own prom!"" line... 

My whole family is upset with him and his parents as well, because last year his parents forced him to go to another girls prom because she didn't want to be alone, even though i specifically told them that I was uncomfortable with it. If I had known her it wouldn't have bugged me so much, but I think its a huge slap in the face for them to disrespect my feelings twice now.  Once when I told them I didn't feel comfortable with that situation, and then now that my prom isn't as important as that girls.  She couldn't be alone, but its ok for me to be?

I sound so selfish when I read this back.  This is a really cool opportunity for him, going to nationals for something is awesome. And I can see how much he wants to... but cant he see how much I want to go to prom? He has an obligation to his team to compete, but I feel like he also has an obligation to me.  He has already decided, hell, he had decided even before he told me about it.  I think what really hurts the most, is that I don't think he has even said sorry about it. 

I don't know what to do about this. I just got my dress back from being altered, but I just put it in my closet and started crying.  I thought I would feel better about this by now, and I have no idea what to do.  I'm scared to tell him, because I don't want him to break up with me because he feels like he can't make me happy anymore. 

He is going to the competition, but I still feel so bitter over it.  I don't want this to ruin our relationship.  Its just prom, and that's what I keep telling myself... but apparently logic doesn't influence my emotions. 

Ladies... how do I deal with this?",0,20140422204027,TwoXChromosomes,t5_2r2jt
t3_23qrdr,"Ladies, I got Nexplanon questions","So I've searched this sub about as much as I can so far and I've gotten mixed reviews on how people feel about it. 

I'm interested in it because I've been on birth control pills for going on 10 years and I'm sick of taking those things daily. My life has gotten more hectic recently (grad school, full time job and multiple volunteer/leadership positions) and I'd rather not have to worry about it. I'm in a long term relationship where we don't want children any time soon (probably never) so I'd really like to not get pregnant.

Some women have said they completely lose their periods and others say that they bleed for long periods of time after the initial implantation. I'm curious to know if the women who lost their period are smaller (weigh less) and that may be why. I have a overweight BMI and I'm concerned that it will cause me to bleed for months on end at the beginning. Other thing I noticed is that women said they lost their sex drive. I already have a pretty low sex drive, I think it has to deal with self-esteem and negative body image more than actual sexual desire. 

Any comments or recommendations would help. 

**TL;DR: Women on Nexplanon. If you lost your period can you tell me if you are overweight? Did you lose sex drive while using this form of birth control? Any other bad side effects?** ",0,20140422232305,TwoXChromosomes,t5_2r2jt
t3_23qlph,"Missing period","Hey twox! I am 22 years old and was on the pill for about 7 years before coming off in August last year. I had one withdrawal period in September and then one more period about 2.5 months later in November. It has now been 5 months since my last period.

I am having regular sex with my boyfriend but we use condoms and the diaphragm every time. I have also done quite a few pregnancy tests in the past 5 months so I'm relatively sure I'm not pregnant.

Other related health things:
- I did change my diet (paleoish - mostly wheat, dairy and soy free now) at around the same time that I went off the pill. 
- I have also noticed an increase in deep sore acne around my jaw line (I had pretty good skin on the pill). 
- I have been trying to lose a little weight (I'm 5""3', was 70kgs, currently 67kgs, would like to be 60kgs) but I eat a lot.

Just wanted to see if anyone else had something similar happen to them after stopping the pill. I'm planning on seeing a hormone specialist soon. Thanks! :) ",0,20140422221322,TwoXChromosomes,t5_2r2jt
t3_23qseg,"My positive experience with Loryna birth control","I started taking birth control a few months ago.  I was prescribed Loryna, which is a generic of Yaz. I did some research on it and found a lot of negative reviews about it. I even searched on this subreddit and found negative reviews. This made me hesitant to take it and worried about what effects it could have on me.

I have been taking it for 4 months now, and I have had no negative reaction to it. No weight gain, cramps, depression, etc. In fact, my face doesn't break out anymore. I haven't had a pimple for a whole month, which has never happened to me before.

All in all, I just want to post this so that if anyone is ever researching Yaz or Loryna they might come across this and not feel as nervous/scared about taking it after reading so many negative reviews. Not everyone is the same, and you could react to it negative, but it's not all bad. ",2,20140422233702,TwoXChromosomes,t5_2r2jt
t3_23qwml,"The Great List of Things I Can't Do Because I Only Have Daughters",http://www.huffingtonpost.com/mike-reynolds/the-great-list-of-things-i-cant-do-because-i-only-have-daughters_b_5125151.html,50,20140423003933,TwoXChromosomes,t5_2r2jt
t3_23qzii,"I just found out my boyfriend of 3 years told another girl he had dumped me this morning. I'm kinda freaking out a lot. Please just tell me its gonna be okay. Please.","",19,20140423013257,TwoXChromosomes,t5_2r2jt
t3_23qwix,"Any good subreddits that show how to do long hair with diagrams or easy to understand explanations?","I know about beautydiagrams and fancy follicles but I'm looking for something that easy for me to understand and try! I've never done my hair but after doing my makeup I feel like I should do my hair too.. ._.

Thanks!",18,20140423003748,TwoXChromosomes,t5_2r2jt
t3_23qyqt,"Was raped years ago, and it's causing me fear now (Triggering)","I was a 15 year old with no self confidence. He was a 17 year old guy who decided to use that against me. No matter how much I told him I didn't want to, he wouldn't listen. He kept pushing me and pushing me. He got so close, my anxiety took over and I froze. He took that as a yes, and that's when it all began. The next couple years were spent with him. I felt too worthless for anyone else. Too dirty. I'd always tell him I don't want to do that. He didn't care. Even when I cried, he ignored it. His forceful touch overpowering my feeble attempts to push him away. He moved away, and I ended it with him, knowing that I wouldn't have to face him and his anger problems. 
I pushed it all deep down. I did my best not to think of it. Now I am 18, and I can't stop thinking about it. Every little thing reminds me of him. I am bisexual, but I tell people I am a lesbian, because whenever I am with a guy I think of him. Now it's getting worse though. Even though he lives hours away, I know he wants to move back here one day, and I fear that I will see him again. Every day I scan my surroundings to make sure he's not anywhere near. I can't get close to anyone without remembering his vile touch. I had a boyfriend who I really cared for, but there's one noise he makes that is the same as one he makes, and I ended it with that guy and haven't spoken since. Whenever I am alone, I want to cry because what he did is all I can think about. I want to be alone though, because of how dirty I feel. 

Why the delayed reaction. How can I forget about him. How can I trust guys again. I just don't know what to do... 

Edit: And I'm sorry if I put this in the wrong place ",7,20140423011905,TwoXChromosomes,t5_2r2jt
t3_23rcpu,"Just... sad","My uncle died just over two weeks ago, but he was just found yesterday, in his residence. I have a large extended family and they're actually really good about checking up on each other, even though we're all spread all over the country. So I don't get it. How could he have died and none of us know? He was pretty youngish still, so it's such a shock and the family is maintaining facebook silence until everyone's been notified so I'm venting here.

He wasn't always a great guy, actually did some terrible stuff several years back, but he cleaned up his act, sobered up and seemed to be on his way to turning his life around. And now he's just-gone. The uncle who gave me my first dog. Who gave me books whenever he saw me when I was younger, who would give me gift cards to barnes and nobles while my other relatives bought me makeup as I got older. The one who, until he got into drugs, was the relative I was compared to the most. 

All over the country, my extended family was celebrating easter just a few days ago. And he was dead and no one knew. I know it's natural to be angry during the grief process, but this doesn't even feel like anger. Just bewilderment. How could he have died and none of us know for two weeks? ",7,20140423062343,TwoXChromosomes,t5_2r2jt
t3_23rgl2,"The Great List of Things I Can't Do Because I Only Have Daughters",http://www.huffingtonpost.com/mike-reynolds/the-great-list-of-things-i-cant-do-because-i-only-have-daughters_b_5125151.html?utm_hp_ref=parents&ir=Parents,4,20140423073240,TwoXChromosomes,t5_2r2jt
t3_23r3vy,"Im a little confused","What does it mean when a guy says he wants to be more than a friends with benefits but less than a boyfriend?
To be fair I would have been fine with either.",2,20140423030417,TwoXChromosomes,t5_2r2jt
t3_23qy8n,"Birth Control Experiences and Concerns","Hey y'all, I'm 17 and going to the gyno for the first time this week (or next). Sexually active and subject to killer periods. I'm trying to figure out the best method of birth control--one that will:

1. Reduce my chances of getting pregnant during PIV sex (the boyfriend and I always use condoms but we want a hormonal method as well just to be sage
2. End the killer periods! I'm sick of missing school and lying in bed feeling miserable. 
3. Not interfere with my other meds (lamictal 200 mg, zoloft 25 mg, and clonidine--not to be confused with klonopin--for bipolar disorder/anxiety nos/sleep)
4. Something cheap. My family is pretty poor but we're fortunate enough to get halfway decent health insurance through my dad's employer (the state). 

Obviously I'll talk to the gynecologist about this and I've been doing thorough research on Planned Parenthood's site. But the My Method app they have isn't too helpful and I want to know more about what people's personal experiences. Also, a few other things:


* I worry about going on the pill because I'm fairly bad at remembering to take the meds I'm currently on, even with reminders and alarms 

* Implanon--the PP website says it doesn't work if you're on certain psych meds--anyone know about this (and obviously I'll consult the gyno and my shrink but just wanted some more info beforehand)? Blog post on Scarleteen said otherwise but didn't specify which meds. Also the insertion method kind of scares me. 

* Mirena: has anyone had an experience with this making their periods lighter? I like the idea of it lasting for five years and being relatively low maintenance. I'm worried about the up front costs and wondering if it will be cheaper than the pill over time. At 18 I think I'm off Dad's insurance? Not sure. 

* I'm very fortunate to have parents and a loving boyfriend who are supportive. Wanted to acknowledge that just 'cuz. 

Thanks so much. I know a lot of this depends on the person but I figured it wouldn't hurt to hear more about everything. I am kind of intimidated by the choice. ",0,20140423010934,TwoXChromosomes,t5_2r2jt
t3_23rhi6,"Falling in love with a married man.","Throwaway because I am paranoid. 

I am married and falling in love with a married man that I am speaking with online.  I live in a new country with my husband and I will not be able to see him, so I know nothing stupid will happen. We are just friends for now, but I have a feeling he feels the same, though neither of us have spoken about it.  We started just talking about normal things and it developed into talking about how our relationships are failing, depression and all sorts of things, though nothing that is inappropriate.   

I know the right thing to do is stop talking to him now, and I know I should see a counselor, but I really just want to hear from other women who have been in this situation and how it turned out, how you dealt with it emotionally.  I am so lost and can't give too much detail about my relationship with my husband.  

Maybe I just needed to get this off my chest.  ",0,20140423074551,TwoXChromosomes,t5_2r2jt
t3_23s7er,"Iggy Azalea had to stop crowdsurfing at her own shows because people would try and finger her",http://hiphopwired.com/2014/04/22/iggy-azalea-no-crowdsurfing-perverts-trying-finger-video/,86,20140423123041,TwoXChromosomes,t5_2r2jt
t3_23srnu,"I was called out in an e-mail today and I can't stop laughing!","It's finals week, and my teacher sent an e-mail saying the final grades are posted on the online course site for my school.

He then says ""There was 1 A+ in the course earned by pronounverbnoun. Congratulations, pronounverbnoun. Too bad EMU will only post an A on pronounverbnoun's transcript.""

I love it, I'm laughing so hard! I wasn't expecting that! I just had to share that with you ladies :)",68,20140423154029,TwoXChromosomes,t5_2r2jt
t3_23rmri,"I'm not trying to sound ungrateful, but my office has invited me to lunch for Administrative Professionals Day, but that's not my job.","I've been invited to go to lunch with the receptionists and office administrator at work tomorrow. I don't know if it's because I'm a female and all the other females in my office do admin jobs and they don't want to exclude me or because they actually think a graphic designer is admin work. Being an administrative professional is a great job, it's just not what I do.

Obviously I'm not going to turn down the invite, they'd be offended and it's good to get a free lunch, but at the same time I want to at least hint that I'm not actually an administrative professional. I design and layout a monthly magazine our company publishes, and any other in-house design work our company needs. Maybe they're just trying to be nice, but the woman here can be quite catty and haven't shown me much respect in the past.

Maybe I'm over thinking it? Should I go and keep my mouth shut? Should I say how happy I was to be invited despite not being an admin worker?",60,20140423085624,TwoXChromosomes,t5_2r2jt
t3_23rw6a,"""The 'confidence gap' is not a personal defect as much as it is a reflection of a culture that gives women no reason to feel self-assured.""",http://www.theguardian.com/commentisfree/2014/apr/23/female-confidence-gap-katty-kay-claire-shipman?CMP=fb_us,33,20140423103857,TwoXChromosomes,t5_2r2jt
t3_23rqfw,"About 1 in 3 American Indian women are sexually assaulted or raped in their lifetimes. An Arizona tribe is set to prosecute first non-Indian under the Violence Against Women Act [Not graphic, but perhaps TW]",http://www.washingtonpost.com/national/arizona-tribe-set-to-prosecute-first-non-indian-under-a-new-law/2014/04/18/127a202a-bf20-11e3-bcec-b71ee10e9bc3_story.html?hpid=z1,26,20140423093944,TwoXChromosomes,t5_2r2jt
t3_23rir0,"A web-based service called Kitestring checks in on you if you're walking alone, and sends a message to your emergency contacts if you don't answer it, to make sure you get home safely.",http://www.elle.com/news/culture/kitestring-app-safety-apps-women?src=spr_FBPAGE&spr_id=1448_53750142&linkId=8004743,21,20140423080444,TwoXChromosomes,t5_2r2jt
